<?xml version="1.0" encoding="UTF-8"?>
<interesovanje xmlns="http://ftn.uns.ac.rs/vakcina/interesovanje"
    xmlns:xsi="http://www.w3.org/2001/XMLSchema-instance"
    xmlns:pred="http://www.ftn.uns.ac.rs/rdf/interesovanje/predicate/"
    xsi:schemaLocation="../schemas/interesovanje.xsd"
    saglasnost_za_imunizaciju="http://www.ftn-vakcine.rs/saglanost/123123"
    id="1">
    <licni_podaci>
        <drzavljanstvo>Drzavljanin_RS</drzavljanstvo>
        <JMBG property="pred:JMBG">094388852429</JMBG>
        <ime>Zoran</ime>
        <prezime>Petrović</prezime>
        <email>petko@gmail.com</email>
        <mobilni_telefon>0684281384</mobilni_telefon>
        <fiksni_telefon>017489976</fiksni_telefon>
    </licni_podaci>
    <lokacija_vakcinisanja>Vranje</lokacija_vakcinisanja>
    <tip_vakcine>Pfizer-BioNTech</tip_vakcine>
    <datum>2021-05-07</datum>
    <potpis>ZPetrović</potpis>
    <davalac_krvi></davalac_krvi>
</interesovanje>